{
  "$ref": "#/definitions/photography",
  "definitions": {
    "photography": {
      "type": "object",
      "properties": {
        "src": {
          "type": "string"
        },
        "alt": {
          "type": "string"
        },
        "caption": {
          "type": "string"
        },
        "title": {
          "type": "string"
        },
        "date": {
          "type": "string"
        },
        "location": {
          "type": "string"
        },
        "category": {
          "type": "string"
        },
        "featured": {
          "type": "boolean",
          "default": false
        },
        "equipment": {
          "type": "string"
        },
        "exposure": {
          "type": "string"
        },
        "description": {
          "type": "string"
        },
        "related": {
          "type": "array",
          "items": {
            "type": "string"
          }
        },
        "processing": {
          "type": "string"
        },
        "$schema": {
          "type": "string"
        }
      },
      "required": [
        "src",
        "alt",
        "caption",
        "date",
        "location",
        "category"
      ],
      "additionalProperties": false
    }
  },
  "$schema": "http://json-schema.org/draft-07/schema#"
}