{
  "src": "/photography/DSC02783.jpg",
  "alt": "Bumblebee",
  "title": "BUMBLEBEE",
  "caption": "Abeja grande aaaaaa",
  "date": "January 2023",
  "location": "La Palma, Spain",
  "category": "insects",
  "equipment": "Takahashi FSQ-106ED, Sony A7III (modified)",
  "exposure": "32 x 5 minutes (2.7 hours total)",
  "description": "The giraffe is a large genus of African equid...",
  "featured": true
}