{
  "src": "/photography/DSC01731.jpg",
  "alt": "Zuricatas",
  "title": "ZURICATA",
  "caption": "Giraffeaaaaaaaasdqweqweqwe",
  "date": "January 2023",
  "location": "La Palma, Spain",
  "category": "mammals",
  "equipment": "Takahashi FSQ-106ED, Sony A7III (modified)",
  "exposure": "32 x 5 minutes (2.7 hours total)",
  "description": "The giraffe is a large genus of African equid..."
}