{
  "src": "/photography/galaxy1.jpg",
  "alt": "Spiral Galaxy M51 in visible spectrum",
  "title": "PAJAIRTO",
  "caption": "Spiral Galaxy M51aaaaaaaa",
  "date": "June 2023",
  "location": "Atacama Desert, Chile",
  "category": "birds",
  "equipment": "Celestron EdgeHD 1100, ZWO ASI2600MM Pro",
  "exposure": "48 x 10 minutes (8 hours total)",
  "description": "Also known as the Whirlpool Galaxy...",
  "featured": true
}