{
  "src": "/photography/DSC01337.jpg",
  "alt": "emperor-tamarin",
  "title": "MONITO EMPEROR",
  "caption": "Emperor Tamarin on Rope Ladderaaaaaaaa",
  "date": "January 2023",
  "location": "La Palma, Spain",
  "category": "primates",
  "equipment": "Takahashi FSQ-106ED, Sony A7III (modified)",
  "exposure": "32 x 5 minutes (2.7 hours total)",
  "description": "A close-up view of an Emperor Tamarin monkey with its distinct white mustache, perched on a rope ladder against a dark background"
}